{
 "$schema": "https://json-schema.org/draft/2020-12/schema",
 "title": "LatinCard",
 "type": "object",
 "required": [
  "id",
  "type",
  "era",
  "latin",
  "translation",
  "context"
 ],
 "properties": {
  "id": {
   "type": "string"
  },
  "type": {
   "enum": [
    "quote",
    "vocab",
    "grammar",
    "person",
    "artifact",
    "place"
   ]
  },
  "era": {
   "enum": [
    "regal",
    "republic",
    "empire",
    "late_antiquity",
    "early_medieval",
    "high_medieval",
    "late_medieval"
   ]
  },
  "unit": {
   "type": "integer",
   "minimum": 1
  },
  "latin": {
   "type": "string",
   "description": "With macrons (Lewis & Short / Wiktionary headwords). Strip for display only if the user turns macrons off."
  },
  "translation": {
   "type": "string"
  },
  "gloss": {
   "type": "array",
   "items": {
    "type": "object",
    "properties": {
     "word": {
      "type": "string"
     },
     "lemma": {
      "type": "string"
     },
     "meaning": {
      "type": "string"
     },
     "parse": {
      "type": "string"
     }
    },
    "required": [
     "word",
     "lemma",
     "meaning"
    ]
   }
  },
  "context": {
   "type": "string",
   "maxLength": 260,
   "description": "Max 40 words (design §6); 260 chars is the enforceable proxy."
  },
  "more": {
   "type": "string"
  },
  "person": {
   "type": "string"
  },
  "source": {
   "type": "object",
   "properties": {
    "work": {
     "type": "string"
    },
    "citation": {
     "type": "string"
    },
    "date": {
     "type": "string"
    }
   },
   "required": [
    "work",
    "citation"
   ]
  },
  "attribution_confidence": {
   "enum": [
    "verified",
    "traditional",
    "apocryphal"
   ]
  },
  "attribution_note": {
   "type": "string"
  },
  "theme": {
   "type": "object",
   "properties": {
    "bg": {
     "type": "string"
    },
    "accent": {
     "type": "string"
    }
   }
  },
  "vocab_ids": {
   "type": "array",
   "items": {
    "type": "string"
   }
  },
  "grammar_tags": {
   "type": "array",
   "items": {
    "type": "string"
   }
  },
  "audio": {
   "type": "object",
   "properties": {
    "classical": {
     "type": "string"
    },
    "ecclesiastical": {
     "type": "string"
    }
   }
  },
  "unlock_rule": {
   "type": "object",
   "properties": {
    "min_vocab_known": {
     "type": "number",
     "minimum": 0,
     "maximum": 1,
     "default": 0.7,
     "description": "Fraction known to unlock as a fully glossed preview."
    },
    "review_threshold": {
     "type": "number",
     "minimum": 0,
     "maximum": 1,
     "default": 0.9,
     "description": "Fraction known for plain, unglossed review."
    }
   }
  },
  "image": {
   "$ref": "#/$defs/image"
  },
  "ipa": {
   "type": "string",
   "description": "Restored classical IPA of `latin`, generated by content/phonetics.py (also in content/phonetics.json keyed by id)."
  },
  "respelling": {
   "type": "string",
   "description": "English-reader respelling, stressed syllable in CAPS, e.g. WAY-nee WEE-dee WEE-kee."
  },
  "teaching_value": {
   "type": "object",
   "properties": {
    "note": {
     "type": "string"
    },
    "dcc_core_pct": {
     "type": "number",
     "minimum": 0,
     "maximum": 100
    },
    "non_core": {
     "type": "array",
     "items": {
      "type": "string"
     }
    },
    "score": {
     "type": "integer",
     "minimum": 1,
     "maximum": 5
    },
    "rank": {
     "type": "integer",
     "minimum": 1
    }
   },
   "required": [
    "score"
   ]
  },
  "register": {
   "enum": [
    "classical",
    "ecclesiastical",
    "medieval",
    "medieval-legal"
   ]
  },
  "grammar_preview": {
   "type": "array",
   "items": {
    "type": "string"
   },
   "description": "Grammar seen but not yet taught; glossed, not tested."
  },
  "learn_more": {
   "type": "object",
   "required": [
    "label",
    "url"
   ],
   "properties": {
    "label": {
     "type": "string"
    },
    "url": {
     "type": "string",
     "format": "uri"
    },
    "verified_http": {
     "type": "string"
    }
   }
  },
  "grammar_target": {
   "type": "array",
   "items": {
    "type": "string"
   },
   "description": "Grammar the card's unit has already taught (tested). Build lint: unit >= max taught unit."
  },
  "source_url": {
   "type": "string",
   "format": "uri",
   "description": "Online text the Latin was verified against."
  },
  "subtype": {
   "enum": [
    "vocab",
    "grammar",
    "derivative",
    "inscription",
    "coin",
    "daily_life",
    "mix:map",
    "mix:who_said_it",
    "mix:parse",
    "mix:timeline",
    "mix:listen",
    "mix:true_false",
    "mix:fill_blank"
   ]
  },
  "teaches": {
   "type": "string",
   "maxLength": 200
  },
  "image_idea": {
   "type": "object"
  },
  "dcc_core_pct": {
   "type": [
    "integer",
    "null"
   ],
   "minimum": 0,
   "maximum": 100
  },
  "dcc_ranks": {
   "type": "object"
  }
 },
 "examples": [
  {
   "id": "q-caesar-veni",
   "type": "quote",
   "era": "republic",
   "unit": 6,
   "latin": "Vēnī, vīdī, vīcī.",
   "translation": "I came, I saw, I conquered.",
   "context": "After crushing Pharnaces II at Zela (47 BC), Caesar had these three words carried on a placard in his Pontic triumph of 46 BC.",
   "person": "Gaius Julius Caesar",
   "source": {
    "work": "Suetonius, Divus Iulius",
    "citation": "37.2",
    "date": "46 BC (triumph); 47 BC (Zela)"
   },
   "attribution_confidence": "verified",
   "attribution_note": "Suetonius: \"in Pontico triumpho … praetulit titulum VENI·VIDI·VICI.\" Plutarch (Caes. 50) says Caesar wrote the words to his friend Amantius; Plutarch writes in Greek.",
   "gloss": [
    {
     "word": "Vēnī",
     "lemma": "veniō",
     "meaning": "I came",
     "parse": "1st sg. perf. act. ind."
    },
    {
     "word": "vīdī",
     "lemma": "videō",
     "meaning": "I saw",
     "parse": "1st sg. perf. act. ind."
    },
    {
     "word": "vīcī",
     "lemma": "vincō",
     "meaning": "I conquered",
     "parse": "1st sg. perf. act. ind."
    }
   ],
   "grammar_tags": [
    "perfect_tense"
   ],
   "vocab_ids": [
    "venio",
    "video",
    "vinco"
   ],
   "unlock_rule": {
    "min_vocab_known": 0.7,
    "review_threshold": 0.9
   },
   "image": {
    "src": "img/caesar.webp",
    "alt": "Marble head of Julius Caesar (Tusculum portrait), Museo di Antichità, Turin, cut out",
    "kind": "statue_cutout",
    "aspect": "3:4",
    "transparent": true,
    "focal_point": [
     0.5,
     0.3
    ],
    "credit": "Tusculum portrait, Museo di Antichità, Turin · photo Marie-Lan Taÿ Pamart (Jastrow)",
    "license": "Public domain",
    "source_url": "https://commons.wikimedia.org/wiki/File:Head_of_Julius_Caesar_from_Tusculum_MAntTorino_2089_n01.jpg"
   }
  },
  {
   "id": "q-caesar-gallia",
   "type": "quote",
   "era": "republic",
   "unit": 3,
   "latin": "Gallia est omnis dīvīsa in partēs trēs.",
   "translation": "Gaul as a whole is divided into three parts.",
   "context": "The opening line of Caesar's own account of his wars in Gaul. Met in Unit 3 as a fully glossed preview; it needs the 3rd declension and a participle.",
   "person": "Gaius Julius Caesar",
   "source": {
    "work": "De Bello Gallico",
    "citation": "1.1",
    "date": "c. 50s BC"
   },
   "attribution_confidence": "verified",
   "gloss": [
    {
     "word": "Gallia",
     "lemma": "Gallia",
     "meaning": "Gaul",
     "parse": "nom. sg. f."
    },
    {
     "word": "est",
     "lemma": "sum",
     "meaning": "is",
     "parse": "3rd sg. pres. ind."
    },
    {
     "word": "omnis",
     "lemma": "omnis",
     "meaning": "all, as a whole",
     "parse": "nom. sg. f."
    },
    {
     "word": "dīvīsa",
     "lemma": "dīvidō",
     "meaning": "divided",
     "parse": "perf. pass. participle, nom. sg. f."
    },
    {
     "word": "in",
     "lemma": "in",
     "meaning": "into",
     "parse": "prep. + acc."
    },
    {
     "word": "partēs",
     "lemma": "pars",
     "meaning": "parts",
     "parse": "acc. pl. f."
    },
    {
     "word": "trēs",
     "lemma": "trēs",
     "meaning": "three",
     "parse": "acc. pl. f."
    }
   ],
   "grammar_tags": [
    "preview",
    "third_declension",
    "perfect_passive_participle"
   ],
   "vocab_ids": [
    "Gallia",
    "sum",
    "omnis",
    "divido",
    "in",
    "pars",
    "tres"
   ],
   "unlock_rule": {
    "min_vocab_known": 0.7,
    "review_threshold": 0.9
   },
   "image": {
    "src": "img/coin.webp",
    "alt": "Silver denarius of Julius Caesar, 47–46 BC: Aeneas carrying Anchises and the Palladium, inscribed CAESAR",
    "kind": "coin",
    "aspect": "4:5",
    "transparent": true,
    "focal_point": [
     0.5,
     0.5
    ],
    "credit": "Silver denarius of Julius Caesar, 47–46 BCE · The Met, Rogers Fund, 1908 (248033)",
    "license": "CC0",
    "source_url": "https://www.metmuseum.org/art/collection/search/248033"
   }
  },
  {
   "id": "q-cicero-tempora",
   "type": "quote",
   "era": "republic",
   "unit": 4,
   "latin": "Ō tempora, ō mōrēs!",
   "translation": "Oh the times, oh the customs!",
   "context": "Cicero's outburst to the Senate, meeting in the Temple of Jupiter Stator on 8 November 63 BC, condemning Catiline's conspiracy against the Republic.",
   "person": "Marcus Tullius Cicero",
   "source": {
    "work": "In Catilinam I",
    "citation": "1.2",
    "date": "63 BC"
   },
   "attribution_confidence": "verified",
   "attribution_note": "Venue: Cic. Cat. 1.1 (hic munitissimus habendi senatus locus); Plut. Cic. 16.",
   "gloss": [
    {
     "word": "Ō",
     "lemma": "ō",
     "meaning": "oh",
     "parse": "interjection"
    },
    {
     "word": "tempora",
     "lemma": "tempus",
     "meaning": "times",
     "parse": "nom./voc. pl. n."
    },
    {
     "word": "ō",
     "lemma": "ō",
     "meaning": "oh",
     "parse": "interjection"
    },
    {
     "word": "mōrēs",
     "lemma": "mōs",
     "meaning": "customs, ways",
     "parse": "nom./voc. pl. m."
    }
   ],
   "grammar_tags": [
    "third_declension"
   ],
   "vocab_ids": [
    "tempus",
    "mos"
   ],
   "unlock_rule": {
    "min_vocab_known": 0.7,
    "review_threshold": 0.9
   },
   "image": {
    "src": "img/cicero.webp",
    "alt": "Marble bust of Cicero, Capitoline Museums, Rome, cut out",
    "kind": "statue_cutout",
    "aspect": "3:4",
    "transparent": true,
    "focal_point": [
     0.5,
     0.3
    ],
    "credit": "Bust of Cicero, Capitoline Museums, Rome · photo Wilfredo Rafael Rodriguez Hernandez",
    "license": "CC0",
    "source_url": "https://commons.wikimedia.org/wiki/File:M._Tullius_Cicero,_Capitoline_Museum,_Rome_(cropped).png"
   }
  },
  {
   "id": "q-horace-carpe",
   "type": "quote",
   "era": "empire",
   "unit": 7,
   "latin": "Carpe diem, quam minimum crēdula posterō.",
   "translation": "Seize the day, trusting as little as possible in tomorrow.",
   "context": "Horace urges Leuconoe to stop consulting fortunes and enjoy the present.",
   "person": "Quintus Horatius Flaccus",
   "source": {
    "work": "Odes",
    "citation": "1.11.8",
    "date": "23 BC"
   },
   "attribution_confidence": "verified",
   "gloss": [
    {
     "word": "Carpe",
     "lemma": "carpō",
     "meaning": "seize, pluck",
     "parse": "2nd sg. pres. imperative"
    },
    {
     "word": "diem",
     "lemma": "diēs",
     "meaning": "day",
     "parse": "acc. sg."
    },
    {
     "word": "quam",
     "lemma": "quam",
     "meaning": "as (with minimum: as little as possible)",
     "parse": "adverb"
    },
    {
     "word": "minimum",
     "lemma": "minimum",
     "meaning": "least",
     "parse": "adverb"
    },
    {
     "word": "crēdula",
     "lemma": "crēdulus",
     "meaning": "trusting",
     "parse": "nom. sg. f., agreeing with Leuconoe"
    },
    {
     "word": "posterō",
     "lemma": "posterus",
     "meaning": "the next (day), tomorrow",
     "parse": "dat. sg. m.; supply diēī"
    }
   ],
   "grammar_tags": [
    "imperative"
   ],
   "vocab_ids": [
    "carpo",
    "dies",
    "credulus",
    "posterus"
   ],
   "unlock_rule": {
    "min_vocab_known": 0.7,
    "review_threshold": 0.9
   },
   "image": {
    "src": "img/horace.webp",
    "alt": "Page of Horace's Odes in a 10th-century manuscript, Florence, Biblioteca Medicea Laurenziana, Plut. 34.1",
    "kind": "manuscript",
    "aspect": "2:3",
    "transparent": false,
    "focal_point": [
     0.5,
     0.3
    ],
    "credit": "Horace, Odes · Biblioteca Medicea Laurenziana, Plut. 34.1",
    "license": "Public domain",
    "source_url": "https://commons.wikimedia.org/wiki/File:Horace,_Odes,_Florence,_Plut._34.1.jpg"
   }
  },
  {
   "id": "q-augustine-tolle",
   "type": "quote",
   "era": "late_antiquity",
   "unit": 9,
   "latin": "Tolle, lege; tolle, lege.",
   "translation": "Take up and read; take up and read.",
   "context": "In a Milan garden, Augustine hears a child's voice from a nearby house chanting these words, opens Paul's letters, and is converted (AD 386).",
   "person": "Augustine of Hippo",
   "source": {
    "work": "Confessiones",
    "citation": "8.12.29",
    "date": "c. AD 397–400"
   },
   "attribution_confidence": "verified",
   "attribution_note": "Augustine says he could not tell whether it was a boy's or a girl's voice (quasi pueri an puellae).",
   "gloss": [
    {
     "word": "Tolle",
     "lemma": "tollō",
     "meaning": "pick up, take up",
     "parse": "2nd sg. pres. imperative"
    },
    {
     "word": "lege",
     "lemma": "legō",
     "meaning": "read",
     "parse": "2nd sg. pres. imperative"
    }
   ],
   "grammar_tags": [
    "imperative"
   ],
   "vocab_ids": [
    "tollo",
    "lego"
   ],
   "unlock_rule": {
    "min_vocab_known": 0.7,
    "review_threshold": 0.9
   },
   "image": {
    "src": "img/augustine.webp",
    "alt": "Sandro Botticelli, St Augustine in his Study, fresco, 1480, Ognissanti, Florence",
    "kind": "painting",
    "aspect": "3:4",
    "transparent": false,
    "focal_point": [
     0.5,
     0.2
    ],
    "credit": "Sandro Botticelli, St Augustine in his Study, 1480, Ognissanti, Florence",
    "license": "PD-art",
    "source_url": "https://commons.wikimedia.org/wiki/File:Sandro_Botticelli_-_St_Augustine_-_WGA02709.jpg"
   }
  }
 ],
 "allOf": [
  {
   "if": {
    "properties": {
     "type": {
      "const": "quote"
     }
    }
   },
   "then": {
    "required": [
     "source",
     "person",
     "attribution_confidence",
     "image"
    ]
   }
  },
  {
   "if": {
    "properties": {
     "type": {
      "enum": [
       "person",
       "artifact",
       "place"
      ]
     }
    }
   },
   "then": {
    "required": [
     "image"
    ]
   }
  }
 ],
 "$defs": {
  "image": {
   "type": "object",
   "required": [
    "src",
    "alt",
    "kind",
    "transparent",
    "license",
    "credit",
    "source_url"
   ],
   "properties": {
    "src": {
     "type": "string"
    },
    "alt": {
     "type": "string"
    },
    "kind": {
     "enum": [
      "statue_cutout",
      "coin",
      "manuscript",
      "building",
      "artifact",
      "inscription",
      "painting"
     ]
    },
    "aspect": {
     "type": "string",
     "description": "e.g. 3:4, 2:3; avoid 1:1"
    },
    "transparent": {
     "type": "boolean"
    },
    "focal_point": {
     "type": "array",
     "items": {
      "type": "number",
      "minimum": 0,
      "maximum": 1
     },
     "minItems": 2,
     "maxItems": 2
    },
    "credit": {
     "type": "string"
    },
    "license": {
     "enum": [
      "CC0",
      "PDM",
      "PD-art",
      "Public domain",
      "CC BY 4.0",
      "CC BY-SA 4.0",
      "Getty Open Content",
      "CC BY 2.0",
      "CC BY 3.0",
      "CC BY-SA 2.0",
      "CC BY-SA 2.5",
      "CC BY-SA 3.0"
     ]
    },
    "source_url": {
     "type": "string",
     "format": "uri"
    },
    "caption_la": {
     "type": "string",
     "description": "Optional short Latin caption so the image teaches."
    },
    "museum_url": {
     "type": "string",
     "format": "uri",
     "description": "'See in museum' link; defaults to source_url."
    },
    "license_note": {
     "type": "string"
    }
   },
   "allOf": [
    {
     "if": {
      "properties": {
       "kind": {
        "enum": [
         "painting",
         "manuscript",
         "inscription"
        ]
       }
      }
     },
     "then": {
      "properties": {
       "transparent": {
        "const": false
       }
      }
     },
     "description": "Cut-outs only for 3D objects."
    }
   ]
  },
  "vocab": {
   "type": "object",
   "required": [
    "id",
    "lemma",
    "meaning",
    "pos",
    "dcc_rank"
   ],
   "properties": {
    "id": {
     "type": "string"
    },
    "lemma": {
     "type": "string",
     "description": "Macronized dictionary form"
    },
    "principal_parts": {
     "type": "string"
    },
    "meaning": {
     "type": "string"
    },
    "pos": {
     "type": "string"
    },
    "dcc_rank": {
     "type": [
      "integer",
      "null"
     ],
     "description": "Rank in DCC Core (null = themed unit lexicon)"
    },
    "unit": {
     "type": "integer"
    },
    "anchors": {
     "type": "array",
     "items": {
      "type": "string"
     },
     "description": "Card ids, e.g. alea → q-caesar-alea"
    }
   }
  }
 }
}