[
 {
  "id": "v-urbs",
  "type": "vocab",
  "subtype": "vocab",
  "unit": 1,
  "era": "republic",
  "latin": "urbs, urbis f.",
  "translation": "city",
  "teaches": "DCC core noun; Rome is simply Urbs",
  "context": "Romans called Rome just 'the City'. Popes still bless 'urbī et orbī' — to the City and the world. English 'urban', 'suburb' come from it.",
  "vocab_ids": [
   "urbs"
  ],
  "grammar_tags": [],
  "image_idea": {
   "description": "Model of ancient Rome (Museo della Civiltà Romana), wide crop",
   "kind": "building",
   "candidate_source": "Wikimedia Commons",
   "license_status": "verified on file page via Commons API: Public domain"
  },
  "learn_more": {
   "label": "Rome (Wikipedia)",
   "url": "https://en.wikipedia.org/wiki/Rome",
   "verified_http": "200"
  },
  "attribution_note": "Constructed teaching sentence (not a quotation).",
  "image": {
   "src": "assets/learning/raw/v-urbs.jpg",
   "alt": "Model of ancient Rome, made by Gismondi",
   "kind": "painting",
   "aspect": "753:522",
   "transparent": false,
   "credit": "Original uploader was Frederika Eilers at en.wikipedia / Wikimedia Commons",
   "license": "Public domain",
   "source_url": "https://commons.wikimedia.org/wiki/File:Model_of_Rome_-_Gismondi.jpg"
  },
  "gloss": [
   {
    "word": "urbs",
    "lemma": "urbs",
    "meaning": "city",
    "parse": "nom. sg. f. (3rd decl.)"
   }
  ],
  "dcc_core_pct": 100,
  "dcc_ranks": {
   "urbs": 82
  }
 },
 {
  "id": "v-via",
  "type": "vocab",
  "subtype": "vocab",
  "unit": 1,
  "era": "republic",
  "latin": "via, viae f.",
  "translation": "road, way",
  "teaches": "1st-declension model noun",
  "context": "The Via Appia, begun 312 BC by Appius Claudius, ran from Rome to Capua and later Brundisium. Its paving stones are still walkable today.",
  "vocab_ids": [
   "uia",
   "via"
  ],
  "grammar_tags": [],
  "image_idea": {
   "description": "Via Appia paving with tombs, portrait crop",
   "kind": "building",
   "candidate_source": "Wikimedia Commons",
   "license_status": "verified on file page via Commons API: CC BY-SA 4.0"
  },
  "learn_more": {
   "label": "Appian Way (Wikipedia)",
   "url": "https://en.wikipedia.org/wiki/Appian_Way",
   "verified_http": "200"
  },
  "attribution_note": "Constructed teaching sentence (not a quotation).",
  "image": {
   "src": "assets/learning/raw/v-via.jpg",
   "alt": "This picture was taken in Rome during the \"mAppiaM!\" event, organised by Wikimedia Italia, farOpen, DigiLab Sapienza / Archeo&amp;Arte3D Lab",
   "kind": "building",
   "aspect": "2592:1944",
   "transparent": false,
   "credit": "Gianfranco / Wikimedia Commons",
   "license": "CC BY-SA 4.0",
   "source_url": "https://commons.wikimedia.org/wiki/File:Rome,_via_Appia_Antica_-_WMI-mAppiaM_2016_-_g8317.jpg"
  },
  "gloss": [
   {
    "word": "via",
    "lemma": "via",
    "meaning": "road, way",
    "parse": "nom. sg. f. (1st decl.)"
   }
  ],
  "dcc_core_pct": 100,
  "dcc_ranks": {
   "via": 196
  }
 },
 {
  "id": "g-sum-est",
  "type": "grammar",
  "subtype": "grammar",
  "unit": 1,
  "era": "republic",
  "latin": "Rōma urbs est. Via longa est.",
  "translation": "Rome is a city. The road is long.",
  "teaches": "sum/est; verb-final word order",
  "context": "Latin usually puts the verb last, but 'est' can float. Start every sentence by finding the verb, then its subject in the nominative.",
  "vocab_ids": [
   "longus",
   "roma",
   "sum",
   "uia",
   "urbs"
  ],
  "grammar_tags": [
   "sum",
   "nominative",
   "word_order"
  ],
  "image_idea": {
   "description": "Cut-out Capitoline Wolf",
   "kind": "statue_cutout",
   "candidate_source": "Wikimedia Commons",
   "license_status": "verified on file page via Commons API: CC BY-SA 4.0 (visual pass Oct 13)"
  },
  "learn_more": {
   "label": "Capitoline Wolf (Wikipedia)",
   "url": "https://en.wikipedia.org/wiki/Capitoline_Wolf",
   "verified_http": "200"
  },
  "attribution_note": "Constructed teaching sentence (not a quotation).",
  "image": {
   "src": "assets/learning/raw/g-sum-est.jpg",
   "alt": "Exterior panoramic view of the Colosseum (Flavian amphitheatre) in Rome",
   "kind": "building",
   "aspect": "7303:3423",
   "transparent": false,
   "credit": "Nicholas Hartmann / Wikimedia Commons",
   "license": "CC BY-SA 4.0",
   "source_url": "https://commons.wikimedia.org/wiki/File:Rome_Colosseum_exterior_panorama.jpg"
  },
  "gloss": [
   {
    "word": "Rōma",
    "lemma": "Rōma",
    "meaning": "Rome",
    "parse": "nom. sg. f."
   },
   {
    "word": "urbs",
    "lemma": "urbs",
    "meaning": "city",
    "parse": "nom. sg. f. (predicate)"
   },
   {
    "word": "est",
    "lemma": "sum",
    "meaning": "is",
    "parse": "3rd sg. pres."
   },
   {
    "word": "Via",
    "lemma": "via",
    "meaning": "road",
    "parse": "nom. sg. f."
   },
   {
    "word": "longa",
    "lemma": "longus",
    "meaning": "long",
    "parse": "nom. sg. f. adj."
   },
   {
    "word": "est",
    "lemma": "sum",
    "meaning": "is",
    "parse": "3rd sg. pres."
   }
  ],
  "dcc_core_pct": 100,
  "dcc_ranks": {
   "urbs": 82,
   "sum": 2,
   "via": 196,
   "longus": 142
  }
 },
 {
  "id": "g-1decl-nom",
  "type": "grammar",
  "subtype": "grammar",
  "unit": 1,
  "era": "regal",
  "latin": "Lupa, puella, rēgīna, Rōma",
  "translation": "she-wolf, girl, queen, Rome",
  "teaches": "1st declension nominative singular -a, mostly feminine",
  "context": "Most -a nouns are feminine. Legend says a lupa nursed Romulus and Remus; 'lupa' was also slang for a prostitute, which ancient writers used to rationalise the myth.",
  "vocab_ids": [
   "lupa",
   "puella",
   "regina",
   "roma"
  ],
  "grammar_tags": [
   "1st_decl",
   "nominative"
  ],
  "image_idea": {
   "description": "Capitoline Wolf bronze cut-out",
   "kind": "statue_cutout",
   "candidate_source": "Wikimedia Commons",
   "license_status": "verified on file page via Commons API: CC0"
  },
  "learn_more": {
   "label": "First declension (Wikipedia)",
   "url": "https://en.wikipedia.org/wiki/First_declension",
   "verified_http": "200"
  },
  "attribution_note": "Constructed teaching sentence (not a quotation).",
  "image": {
   "src": "assets/learning/g-1decl-nom.png",
   "alt": "Lupa Capitolina: she-wolf with Romulus and Remus. Bronze, 12th century AD[1], 5th century BC (the twins are a 15th-century addition).",
   "kind": "statue_cutout",
   "aspect": "7489:4876",
   "transparent": true,
   "credit": "Wikimedia Commons / Wikimedia Commons",
   "license": "CC0",
   "source_url": "https://commons.wikimedia.org/wiki/File:Lupa_Capitolina,_Rome.jpg"
  },
  "gloss": [
   {
    "word": "Lupa",
    "lemma": "lupa",
    "meaning": "she-wolf",
    "parse": "nom. sg. f."
   },
   {
    "word": "puella",
    "lemma": "puella",
    "meaning": "girl",
    "parse": "nom. sg. f."
   },
   {
    "word": "rēgīna",
    "lemma": "rēgīna",
    "meaning": "queen",
    "parse": "nom. sg. f."
   },
   {
    "word": "Rōma",
    "lemma": "Rōma",
    "meaning": "Rome",
    "parse": "nom. sg. f."
   }
  ],
  "dcc_core_pct": 33,
  "dcc_ranks": {
   "lupa": null,
   "puella": 233,
   "rēgīna": null
  }
 },
 {
  "id": "i-spqr",
  "type": "artifact",
  "subtype": "inscription",
  "unit": 1,
  "era": "republic",
  "latin": "S·P·Q·R — Senātus Populusque Rōmānus",
  "translation": "The Senate and the Roman People",
  "teaches": "Abbreviations; enclitic -que = 'and'",
  "context": "The formula named the Roman state on coins, arches and standards. Rome's manhole covers still carry it. Note -que glued to the second word: populus-que.",
  "vocab_ids": [
   "populus",
   "romanus",
   "senatus"
  ],
  "grammar_tags": [
   "enclitic_que",
   "abbreviations"
  ],
  "image_idea": {
   "description": "Modern Rome manhole cover with SPQR or Arch of Titus attic",
   "kind": "inscription",
   "candidate_source": "Wikimedia Commons",
   "license_status": "verified on file page via Commons API: CC BY-SA 3.0"
  },
  "learn_more": {
   "label": "SPQR (Wikipedia)",
   "url": "https://en.wikipedia.org/wiki/SPQR",
   "verified_http": "200"
  },
  "attribution_note": "Constructed teaching sentence (not a quotation).",
  "image": {
   "src": "assets/learning/raw/i-spqr.jpg",
   "alt": "Dedicatory inscription on the Arch of Titus in Rome:\nThe Senate and the Roman People  to the divine Titus—son of the divine Vespasian— Vespa",
   "kind": "inscription",
   "aspect": "1049:250",
   "transparent": false,
   "credit": "Vincent Ramos / Wikimedia Commons",
   "license": "CC BY-SA 3.0",
   "source_url": "https://commons.wikimedia.org/wiki/File:Arch.of.Titus-Inscription.jpg"
  },
  "gloss": [
   {
    "word": "Senātus",
    "lemma": "senātus",
    "meaning": "senate",
    "parse": "nom. sg. m. (4th decl.)"
   },
   {
    "word": "Populusque",
    "lemma": "populus",
    "meaning": "people (+ -que \"and\")",
    "parse": "nom. sg. m."
   },
   {
    "word": "Rōmānus",
    "lemma": "Rōmānus",
    "meaning": "Roman",
    "parse": "nom. sg. m. adj."
   }
  ],
  "dcc_core_pct": 100,
  "dcc_ranks": {
   "senātus": 329,
   "populus": 122
  }
 },
 {
  "id": "x-map-roma",
  "type": "place",
  "subtype": "mix:map",
  "unit": 1,
  "era": "regal",
  "latin": "Septem montēs: Palātium, Capitōlium, Aventīnus…",
  "translation": "The seven hills: Palatine, Capitoline, Aventine…",
  "teaches": "Place names in the nominative; map-tap game",
  "context": "Tap each hill as you hear its Latin name. The Palatine gave English 'palace', because emperors built their homes there.",
  "vocab_ids": [
   "auentinus",
   "capitolium",
   "mons",
   "palatium",
   "septem"
  ],
  "grammar_tags": [],
  "image_idea": {
   "description": "Public-domain map of the seven hills of Rome",
   "kind": "painting",
   "candidate_source": "Wikimedia Commons",
   "license_status": "verified on file page via Commons API: Public domain"
  },
  "learn_more": {
   "label": "Seven hills of Rome (Wikipedia)",
   "url": "https://en.wikipedia.org/wiki/Seven_hills_of_Rome",
   "verified_http": "200"